as a user i created a composed job with over 10 child jobs in the workflow i expected to see a job in the execution list page without any pagination but instead i noticed empty pagination to skip to next page,1
as a user i want to be able to provide security credentials to the xd shell so that i can interact with an xd admin server that is secured via basic auth technical implementation add ---password and --username to the admin config command,5
as a developer id like to upgrade to si kafka release so i can synchronize with latest improvements and bug fixes,1
as a user id like to use the admin-ui and flo with consistent look and feel,1
as a xd developer id like to reproduce and fix anomalies as listed herehttpsgithubcomspring-projectsspring-xd-admin-ui-clientissues9,1
as a developer id like override the partition function within my source or processor module so i can send the data to a specific partition,5
as a developer id like to clean-up compiler and javadoc warnings from the build so we dont see the warnings in build sysout,2
as a user id like to have an option to specify timeout so i can expect the job to not run forever if it is in hung state,3
as a developer id like to upgrade to 221 ga release so i can leverage the latest improvements without breaking backwards compatibility shdp 230 uses boot 13 and hdp and cdh versions that drop older hive support to avoid breaking changes we should instead use shdp 221 that has backported any improvements that we need as well as move spring and hadoop versions to more recent ones,1
as a user id like to have an optional trace as inline deployment properties for stream so that i can declare which module in the stream needs to be traced for logging or notifications this gives the flexibility to track the stage progress between individual modules example codexml xd stream create foo http log xd stream deploy foo --properties modulehttptracemodulelogtrace or xd stream deploy foo --properties moduletrace code wildcard wiretap config httpdocsspringiospring-integrationreferencehtmlmessaging-channels-sectionhtmlchannel-global-wiretap,8
as a user id like to consume multiple topic-partitions so i can have the option to consume from multiple data endpoints and still be able to serve the data via single queue,3
as a spring xd developer id like to move tcp module from xd to s-c-s repo so i can use it as source to build streaming pipeline,2
as a user id like to have the flexibility to specify config options for ip and hostname so that i can list the correct configuration for xd admin and xd container servers in the admin-ui and shell,1
as a developer id like to create a end-to-end kafka use-case so i can study demonstrate and verify kafka xd play thats built for scale and performance,3
as a user i cannot use admin-ui on the master build it wont come up,2
as a user id like to parameterize codegen options so i can generate code on the fly as needed,5
as a user id like to refer to the documentation so i can configure hdfs backed module registry xd-2287 as recommended,1
as a user id like to have shell to automatically configure itself against an environment i have setup this really came up with ambari work where shell can be anywhere in a cluster best i was able to do for now is to build an init file for commandsambari xd-shell deploy already knows locationsaddresses for xd admin and namenode code cat etcspringxdconfxd-shellinit admin config server httpambari-2localdomain9393 hadoop config fs --namenode hdfsambari-2localdomain8020 code and then run those after starting xd-shell code server-unknownscript --file etcspringxdconfxd-shellinit admin config server httpambari-2localdomain9393 successfully targeted httpambari-2localdomain9393 hadoop config fs --namenode hdfsambari-2localdomain8020 script required 0662 seconds to execute xd code,1
as a user id like to have the option to store the custom module uber-jar in hdfs so that i can rely on the ha feature to reliably read and reinstall under failure scenarios,3
as a s-c-d developer id like to create moduleregistry implementation so i can use this infrastructure to lookup module coordinates by name,8
as a pm id like to have test coverage for both kafka source and sink modules so that we can assert its functionality as part of the ci builds,8
as a qa id like to include acceptance test coverage for router sink module so that i can validate the functionality as part of every ci build,3
as a s-c-d user i should be prevented from creating streams with duplicate name id expect streams to have unique names all the time,1
as a developer id like to handle the non-default configurableconversionservice tuples in an uniform manner so theyre not reset after deserialization,5
as a developer id like to refactor the programmatic means by which the messagebus transforms the message so throughput performance can be optimized,5
as a user id like to have the option of hawq sink so that i can write data directly into hawq via pxf extensions through avroparquet format,3
as a s-c-s developer id like to adapt redis counter from xd to s-c-s so i can build streaming pipes using s-c-s modules with simple counters to feed dashboards,3
as a spring xd developer id like to refactor current controller with spi calls so i can invoke the respective admin spi implementation based on the deployment controllers to refactor containerscontroller streamscontroller modulescontroller jobscontroller,5
as a qa id like to include acceptance test coverage for reactor-syslog source module so that i can validate the functionality as part of every ci build,3
as a user id like to have an option to have the hdfs sink use syncable writes to provide better resiliency in the case of sinkcontainer failures im willing to accept the performance penalty if i choose this option,3
as a s-c-d developer id like to add support for profiles to the core admin application so i can back the stream repository with respective backend strategy for example local profile would use in-memory strategy to store the metadata,3
as a performance tester id like to rerun baseline benchmarks with batching enabled on rabbit so that i can compare the results with previous performance snapshots note - batchingenabled true - batchingsize 100 default we could also vary default size to compute and record at granular level,3
as a qa id like to include acceptance test coverage for analytic-pmml processor module so that i can validate the functionality as part of every ci build,3
as a user id like to have the ability to use expressions so i can dynamically name directoriesfiles based on the timestamp or other intermediate data point,5
as a developer id like to enhance test coverage to capture dsl and xml generation variants,5
as a developer id like to port rich-gauge module from xd to s-c-s repo so i can use it as sink module to build streaming pipeline,2
as a developer im adding new overrides to serveryml file however the overridden properties do not reflect even after the restart of server,2
as a spring xd developer id like to move mqtt module from xd to s-c-s repo so i can use it as source to build streaming pipeline,2
as a user id like to have the option of compression for both rabbit source and sink modules so that can further enhance the performance characteristics,8
as a xd developer id like to upgrade to si 42 spring 421 and amqp 15 dependencies so i can take advantage of the latest improvements,3
as a s-c-s developer id like to setup ci builds for s-c-s builds so i can incrementally build and test code commits automatically,3
as a developer id like to add undeployed status for lattice spi so i can represent the correct status instead of the current unknown state,3
as a devops i would prefer having my module registry located in centralized github repository this would allow all the admins and containers in the cluster pointing to the same module registry any new module upload would be pushed to the same github repo which will make the cluster always be in sync on the module registry,5
as a user id like to refer to documentation in wiki so that i can setup and configure kafka as a message bus as recommended,2
as a user id like to have the option to explicitly defineconfigure error channel so that i can stage and route the errorsexceptions through the dedicated channel and continue ingestion scenario http source ingest failure at either source processor or sink module regardless of whether it is a custom module or not traverse through the exception to propagate the actual caused by stage the error as payload and route it to the error channel example configuration error channel definition similar to topicerrorsstreammodule configure custom exception similar to catchexception exception hierarchy globalexception defaultexception modulespecificexception,8
as a spring xd developer id like to have a permanent location of spi implementations so i could use the common repo every time i contribute or enhance the test coverage,3
as a developer id like to continue xd-on-latticediego poc and will be focused on the design of a pluggable spi so it is more generally applicable than lattice with the receptor api being just one implementation option,8
as a user id like to have api and documentation links in the abouthttpsgithubcomspring-projectsspring-xdblobmasterspring-xd-uiappscriptssharedviewsabouthtml section within admin-ui it would be ideal to have the version dynamically replaced for every release,1
as a developer id like to add support for undeployed status consistently across all the deployers so i can present the correct status instead of the current unknown this is applicable for existing streams without any deployment context associated with it,1
as a developer id like to upgrade to si 422ga release so i can leverage the latest improvements,1
as a user i want to know how to enable and configure ldap as an authentication provider for the administration server so that i can set up my security configuration accordingly,1
as a spring xd user id like to have ipython notebook integration so i can perform interactive data computations in real-time,8
as a developer id like to default to hdfs as distributed remote location for custom module registry so i can use xd-shell or the rest-api directly to upload the custom module bits i would also like to remove custom-moduleszip artifact from yarn distribution,3
as a user id like to have the option to configure permissions so that ill have the flexibility to bind permissions rest endpoint to a specific role default roles admin crud viewer r,2
as a user id like to have the ability to mass-ingest data from various database systems so that im not restricted with the current approach jdbchdfs that is dependent on jdbc drivers spike scope identify integration options collaborate to determine the design document outcome design specs,5
as a developer id like to migrate the current master branch ci builds to ec2 instances so i can manage them all in one-place reliably,8
as a flo for spring xd user i would like to be able to create a new stream using the graphicat ui this flow should be shown in a graphical way also in definition tab httpexamplecomimagepng right now it doesnt happen due to a javascript error code typeerror thisnodegettransformtoelement is not a function at objectvelementbbox httplocalhost9393admin-uilibjointsrcvectorizerjs32336 at jointdiaelementviewjointdiacellviewextendpositionrelative httplocalhost9393admin-uilibjointdistjointallcleanjs274051 at nullanonymous httplocalhost9393admin-uilibjointdistjointallcleanjs271018 at httplocalhost9393admin-uiliblodashlodashcompatjs117723 at eval eval at createiterator httplocalhost9393admin-uiliblodashlodashcompatjs10 anonymous109 at functionforeach httplocalhost9393admin-uiliblodashlodashcompatjs36459 at jointdiaelementviewjointdiacellviewextendupdate httplocalhost9393admin-uilibjointdistjointallcleanjs270011 at bound as update httplocalhost9393admin-uiliblodashlodashcompatjs100521 at jointdiaelementviewjointdiacellviewextendrender httplocalhost9393admin-uilibjointdistjointallcleanjs290314 at jointdiapaperbackboneviewextendaddcell httplocalhost9393admin-uilibjointdistjointallcleanjs500414anonymous function 9393admin-uilibangularangularjs11500 9393attachment-namejpgthumbnail code,1
as a developer id like to add support for dynamic classpath for modules so we can have the flexibility to load the right dependencies either based on module options 0 or via other properties such as including the dependencies from a specific location 1 0 code libjarlibdistrojar code 1 code xdhomelibhadoopdistrojar code example code http hdfs --distrophd22 http mycustommodule --classpathmyfunkydir http jpa --providereclipse jpa config libsomething-that-is-commonjar eclipseeclipse-link-32jar hibernatehibernate-core-50jar moduleclasspath libjarlibproviderjar code,5
as a s-c-d developer id like to explore options to bootstrap and setup lattice based infrastructure for s-c-ds bare metal deployment,5
as a pm id like to have the smart grid demo from s1-2014 ported into spring xd samples repo,8
as a user id like to refer to the wiki so that i can create a job with partitions that in turn expects tablename and columns be explicitly included in the job definition it is also beneficial to call-out sql and tablename metadata options are mutually exclusive following logic in jdbchdfsoptionsmetadata needs documented codejava asserttruemessage use tablename and columns when using partition column boolean ispartitionedwithtablename if stringutilshastextpartitioncolumn return stringutilshastexttablename stringutilshastextsql else return true code,1
as a developer id like to troubleshoot and fix root level access over cf spi rest calls theyre broke at the moment access for following calls fail code href httpss-c-dataflow-admincfappspezpivotalio80streams href httpss-c-dataflow-admincfappspezpivotalio80tasks href httpss-c-dataflow-admincfappspezpivotalio80metricscounters href httpss-c-dataflow-admincfappspezpivotalio80metricscountersname href httpss-c-dataflow-admincfappspezpivotalio80modules href httpss-c-dataflow-admincfappspezpivotalio80completionsstreamstartdetaillevel code,1
as a user id like to have an option to disable db requirement so that i can setup to use dirt runtime when stream processing is the only requirement,8
as a s-c-d developer id like to investigate how to includeexclude msg busbinding jars so i can decide the binding selection and fallback mechanism when there is none setup,5
as a user id like to have the ootb module to consume database changes as event streams so i can incrementally synchronize with real-time db updates with various destinations such as brokers hadoop db etc,8
as a developer id like to add an option to support apache ambari installed spring xd on yarn so i can easily establish the cluster up and running,5
as a flo developer id like to add improvements to existing flo parser endpoints so i can streamline the error reporting strategy,3
as a developer i want to be able to connect to multiple external systems for the same binding type so that i can read data from a system and write it to another,5
as a qa id like to include acceptance test coverage for throughput-sampler sink module so that i can validate the functionality as part of every ci build,3
as a developer id like to add undeployed status for k8s spi so i can represent the correct status instead of the current unknown state,1
as a build manager id like to schedule ci builds for windows so that i can verify xd runtime featuresfunctionality the scope is to isolate the remaining test failures perhaps experiment with new ami images until we have a solid infrastructure to fix the failing tests,1
as a qa id like to include acceptance test coverage for kafka as a message bus so that i can validate the functionality as part of every ci build,5
as a developer id like to port field-value-counter module from xd to s-c-s repo so i can use it as sink module to build streaming pipeline,2
as a developer id like to upgrade to si milestonega release so i can synchronize with jmx improvements this is dependent on si milestone and ga release timelines,1
as a developer id like to document the changes to message headers so that users can refer to the troubleshooting section if there are any serialization errors when reusing the 10 batch-jobs in 11 release perhaps this could be part of troubleshootinghttpsgithubcomspring-projectsspring-xdwikideploymenttroubleshooting section in our wiki,1
as a user id like to have the option to write into kafka sink so that i can publish mass data into kafka broker,8
as a qa id like to include acceptance test coverage for both script and scripts processor modules so that i can validate the functionality as part of every ci build,3
as a s-c-d developer id like to enhance integration test coverage for yarn spi so i can continuously evaluate functionalities via ci pipeline,5
as a developer id like to have a central place to manage external properties for applications across all the environments so i can provide server and client-side support for externalized configuration for xd-admin and xd-container servers,8
as a qa id like to include acceptance test coverage for timestampfile batch job so that i can validate the functionality as part of every ci build,3
as a developer id like to have the high-level description for each of the modules so that i can use the description presumably what is captured in javadoc for the module definition to understand the purpose of the module itself,3
as a developer id like to benchmark rabbit performance so that i can use the results as reference to setup xd cluster,8
as a developer id like to create a gpload tasklet so i can ingest data from various sources into gpdb in an efficient manner,5
as a developer id like to refer to wiki so that i can configure machines with recommended ulimit setting for xds distributed setup note recommended ulimit setting is 10k under troubleshooting new section exception reason to increase ulimit 82552266 110snap error deploymentspathchildrencache-0 serverdeploymentlistener - exception deploying module javalangillegalstateexception javaiofilenotfoundexception varvcapdatapackagesspringxdee02bd3482eeb620a65862fb54e1f23fcece80221-bd a341640a5de2f922fd3db906ce504b85819c1espring-xd-110build-snapshotxdconfigmodulesmodulesyml too many open files,1
as a developer id like to create separate repo for lattice spi so i dont have to bundle all spi variants under one admin project,3
as a user i want to be able to control the starting offset of the kafka source when a stream is deployed so that i can replay a topic if necessary note - starting offset is only considered when the stream is deployed - progress made by modules must survive their crash for a running stream - undeploying and redeploying a stream with a specific start offset will cause the stream to read again from the start tbd what happens when streams are undeployedredeployed - where do they resume from,8
as a spring xd user id like to use diego based receptor implementation of xd admin spi based on modulelauncher so i can run data pipeline use-cases running on cf latticediego,8
as a user id like to have a sample app github project so that i can use it as a reference while provisioning spring xd cluster with kafka consider kafka as message bus kafka as source,8
as a user id like to have latest spring boot snapshot pulled as a dependency so that i can inherit and implement the ootb security features,1
as a developer id like to remove id and timestamp attributes from the tuple class so i can improve performance characteristics by not having them go through serde instead we could leverage message headers to collect such information,3
as a performance tester id like to re-run baseline benchmarks with compression enabled on rabbit so that i can compare the results with previous performance snapshots,3
as a field engineer id like to have a comparison of spark streaming examples in spring xd so that it is easy to relate from implementation standpoint,8
as a developer id like to port gauge module from xd to s-c-s repo so i can use it as sink module to build streaming pipeline,2
as a user id like to use the latest release of gemfire sink so i can create a streaming pipeline to land data in gemfire,2
as a s-c-d developer id like to move rabbit module from xd to s-c-s repo so i can use it as sink to build streaming pipeline,2
as a spring xd developer id like to port aggregator module from xd to s-c-s repo so i can use it as processor module to build streaming pipeline,2
as a user i want to be able to control the partition allocation for the kafka source modules when a stream is deployed so that i can colocate with other data sources,8
as a user id like to have the option to provide file based security configurations so that i can access the endpoints in a secured manner ideally all the listed endpoints httplocalhost9393 needs to be encapsulated within file based security layer reference securing web apphttpsspringioguidesgssecuring-web,5
as a spring-bus lead id like to review the current spring-bus architecture and the design specs so i can address any foundation level gaps,5
as a user id like to override the default commit-interval so that i can configure commit interval depending on data volume note this would apply for all ootb jobs that has partition support the property could be part of serversyml file,3
as a user id like to use the mail source to connect to secured imap andor smtp mail servers mail source config file requires a utilproperties bean with ssltls properties provided to the adapter via the java-mail-properties attribute ref examplehttpdocsspringiospring-integrationdocslatest-gareferencehtmlmailhtml codexml beansbeans profiledefault utilproperties idjavamailproperties beansprop keymailimapsocketfactoryclassjavaxnetsslsslsocketfactorybeansprop beansprop keymailimapsocketfactoryfallbackfalsebeansprop beansprop keymailstoreprotocolimapsbeansprop beansprop keymaildebugfalsebeansprop utilproperties beansbeans code list of all java-mail propertieshttpsjavamailjavanetnonavdocsapicomsunmailsmtppackage-summaryhtml,1
as a s-c-d developer id like to add hdfs sink to module registry so i can use this module to build streaming pipeline and write to hadoop,1
as a user i would like to be able disable snappy compression when using hdfs-dataset sink with avro files id also like to be able to provide a different codec,1
as a user i need to have the ability to create docker images via ci build so that i can build all the componentsconfigurations i need into a docker image test it and deploy the image to various environments,8
as a s-c-s developer id like to refactor the current modulelauncher contract with boots jarlauncher api so we dont have to maintain duplicate functionality,1
as a developer id like to add a new ci build to include install target so i can verify the target expectations as it is often time consuming to verify it in the development environment,2
as a developer i would like to create dsl based jobs using spring xd currently batchjobregistrybeanpostprocessor implementation has an assumption in postprocessafterinitialization method line 92 it checks if the beans are instanceof stepparserstepfactorybean which is xml based steps therefore any xd step listeners for tap events are not getting registered effectively im not getting any step events out of my dsl based jobs apparently everything else is working alright for the java dsl job java dsl jobs are far easier to write testintegration tests with please review issue type - i was not sure if this was a bug or improvement i supposed it is an improvement,1
as a tester id like to add test coverage for complex objects such protocol buffers any object with nested variables or a tree of objects so that i can evaluate and document the performance characteristics,8
as a developer id like to investigate channel performance issues in si 42 so i can determine the bottlenecks and take corrective actions to improve overall channel performance,8
as a s-c-d developer id like to have module info shell command so i can query each of the module specifics such as description and support options,2
as a user i should not be allowed to create a custom module with a reserved keywords so that i it will avoid confusions from seeing duplicate strings in deployment manifest example we would like to avoid a custom module name of producer to eliminate the confusion below code xdstream deploy --name test1 --properties moduleproducerproducerdeliverymode persistentmodulelogcriteriagroupscontainsgroup1 code list of available reserved keywordshttpsgithubcomspring-projectsspring-xdwikideploymentdeployment-properties,5
as a user id like to have the option to define access control list acls so that i can define access controls to the resource by each user and what the privileges are for that resource spike scope review customer use cases and come up with design specs identify the best approach that fits xd runtime identify scope for dsl and ui document next steps and phases,8
as a user i would like to specify the default output channel when the channel name resolution doesnt occur in cases where i wont prefer to lose the data and like to investigate the messages from errorchannel or that sort,2
as a user id like to upgrade spring xd from 12 rc to 12 ga using the ambari plugin so i can work on the latest release bits id like to refer to the documentation to do so,1
as a developer id like to refactor streamjob definition repository so i can decouple from module deployment concerns,8
as a user id like to have a r processor so i can efficiently perform data computations and statistical analysis in the context of streaming pipeline investigate the right approach that fits spring xd model r java libraries rjavahttprforgenetrjava renjinhttpwwwrenjinorg,8
