as a developer id like to update ambari installed spring xd cluster to spin-up multiple instances of xd-admin servers so it is setup for ha,5
as a user im trying to list streams 20 in admin-ui to use the pagination however i ended up with blank page and the server-side errored with javalangillegalstateexception version 110 snapshot master build distributed 1 admin and 2 containers steps to reproduce 1 deploy the following streams stream create foo1 --definition time log --deploy stream create foo2 --definition time log --deploy stream create foo3 --definition time log --deploy stream create foo4 --definition time log --deploy stream create foo5 --definition time log --deploy stream create foo6 --definition time log --deploy stream create foo7 --definition time log --deploy stream create foo8 --definition time log --deploy stream create foo9 --definition time log --deploy stream create foo10 --definition time log --deploy stream create foo11 --definition time log --deploy stream create foo12 --definition time log --deploy stream create foo13 --definition time log --deploy stream create foo14 --definition time log --deploy stream create foo15 --definition time log --deploy stream create foo16 --definition time log --deploy stream create foo17 --definition time log --deploy stream create foo18 --definition time log --deploy stream create foo19 --definition time log --deploy stream create foo20 --definition time log --deploy stream create foo21 --definition time log --deploy stream create foo22 --definition time log --deploy 2 go to streams tab in admin-ui to get a blank page and the following exception in admin logs error 165519107 110snap error http-nio-9393-exec-2 restrestcontrolleradvice - caught exception while handling a request javalangillegalstateexception not all instances were looked at orgspringframeworkutilassertstateassertjava385 orgspringframeworkxddirtrestxdcontrollerenhancewithdeploymentsxdcontrollerjava207 orgspringframeworkxddirtrestxdcontrollerlistvaluesxdcontrollerjava178 orgspringframeworkxddirtreststreamscontrollerliststreamscontrollerjava63,1
as a user i need a sandbox docker image so that i can get started to experiment xd deployment with the following setup ubuntu os full xd jar java 7x redis rabbitmq,5
as a developer id like to upgrade boot and spring cloud build revisions so i can leverage the latest updates,5
as a field engineer id like to have a comparison of storm examples in spring xd so that it is easy to relate from implementation standpoint,8
as a user id like to have the flexibility to change the namespace so that i can isolate zk metadata based on each tenant profile,5
as a developer id like to resolve remaining gaps wrt ci pipelines for data flow and the family so i can continuously evaluate functionalities on every commit,8
as a user id like to have the option of batching for the rabbit sink so that i can write data in batches as opposed to one-at-a-time,5
as a user i need the ability to configure docker xd containers so that i can link to external services such as rabbit redis zookeeper hadoop mongo etc includes pointers to linkingbinding attributes environment variables,8
as a developer id like to identify the kafka configurations so that i could setup infrastructure to perform performance testing,3
as a developer id like to upgrade to 060 release of lattice so i can demonstrate data flow on the latest lattice improvements,5
as a user id like to have the ability to access the random port generated by tomcat of the admin server via xd-shell so that i can point to the server and continue my interactions spike details research whether connecting xd-shell directly to zk is a good approach or have a lb in-charge for the interaction how about something other than a pointer to a zk directory in the shell for folks to experiment a bit before getting a lb involved note on some hadoophdfs setups access to zk is mandatory from hdfs client libs there are some ha and federation setups which would anyway require xd shell to get access to zk if fs shell commands are used,8
as a spring xd developer id like to port http-client module from xd to s-c-s repo so i can use it as processor module to build streaming pipeline,2
as a s-c-d user im unable to push admin app to cf due to ssl certification errors while bootstrapping consider adding cf trusted certificatehttpsgithubcompivotal-cfcloudfoundry-certificate-truster as a cf spi dependency adding cf trusted certificate as dependency doesnt help either code fri sep 25 2015 125532 gmt-0400 edt app0 err caused by sunsecurityvalidatorvalidatorexception pkix path building failed sunsecurityprovidercertpathsuncertpathbuilderexception unable to find valid certification path to requested target fri sep 25 2015 125532 gmt-0400 edt app0 err at sunsecurityvalidatorpkixvalidatordobuildpkixvalidatorjava387 fri sep 25 2015 125532 gmt-0400 edt app0 err at sunsecurityvalidatorpkixvalidatorenginevalidatepkixvalidatorjava292 fri sep 25 2015 125532 gmt-0400 edt app0 err at sunsecurityvalidatorvalidatorvalidatevalidatorjava260 fri sep 25 2015 125532 gmt-0400 edt app0 err at sunsecuritysslx509trustmanagerimplvalidatex509trustmanagerimpljava324 fri sep 25 2015 125532 gmt-0400 edt app0 err at sunsecuritysslx509trustmanagerimplchecktrustedx509trustmanagerimpljava229 fri sep 25 2015 125532 gmt- code,3
as a developer id like to add support for dynamic partition subscription for the kafka source module so i can consume the payload from dynamic partitions,5
as a developer i want to be able to override kafka bus defaults for module consumers and producers so that i can finely tune performance and behaviour such properties should include - autocommitenabledqueuesizemaxwaitfetchsize for consumers - batchsizebatchtimeout for producers,3
as a spring xd developer id like to move mail module from xd to s-c-s repo so i can use it as source to build streaming pipeline,2
as a user i should be able to leverage native elasticsearch sink so that i can aggregate search and analyze data insights in real-time,8
as a user id like to parameterize merge options so i can incrementally consume the delta with the help of megastore,5
as a spring xd user im trying to use a custom mongodb batch job however im getting an error running it against 120121 release while the same works with older releases of spring xd more details in this so threadhttpstackoverflowcomquestions31838720mongodb-batch-job-broken-in-spring-xd-1-2-0,3
as a spring xd developer id like to move mail module from xd to s-c-s-m repo so i can use it as source to build streaming pipeline,2
as a user id like to have the ability to configure acls so that i can restrict access to resources accessed via admin ui examples who can create streams who can destroy the streams who can view the streams defaults to all,8
as a developer id like to continue latticediego poc so that i can identify the scope risks and the overall design for a pluggable spi in xd runtime,5
as a user id like to have microbatching capability so that i can ingest based on batch intervals for enhanced performance throughput example http --batchinterval10 log,5
as a developer id like to document performance benchmark results along with the infrastructure specifics so i can publish the blog for customersusers to use it as a reference while setting up spring xd cluster,8
as a user id like to have the option of websocket source module so that i can create a interactive communication channel between users browser session and the runtime to ingest browser based events and activities reference spring integration websocket supporthttpsgithubcomspring-projectsspring-integrationtreemasterspring-integration-websocketsrc,3
as a user id like to have the option of cassandra sink so i can leverage the nosql database to write high volumes of variable data segments in high velocity,3
as a spring xd developer id like to port tcp module from xd to s-c-s repo so i can use it as source module to build streaming pipeline,2
as a developer id like to add undeployed status for yarn spi so i can represent the correct status instead of the current unknown state,3
as a developer id like to create a java clienthttpsgithubcommarkfisherreceptor-client for receptor so i can interact with diego runtime via receptor api calls from xd,8
as a user id like to be able to understand the root cause of an error on the http shell command when an exception occurs on an http shell command the user gets failed to access http endpoint s target no information from the exception is conveyed to the user nor is it logged by the admin,1
as a user id like to have an option of aws source module so that i can ingest data from amazon s3 or use the simple email service ses reference spring integration aws extensionhttpsgithubcomspring-projectsspring-integration-extensionstreemasterspring-integration-aws,5
as a developer id like to review the current sonar violations so that i can fix the relevant and update the irrelevant ones as invalid,3
as a developer id like to update all the module docs to also include shortdescription so that its available for users to learn more about the module,2
as a developer id like revisit the design to determine the necessity for id and timestamp attributes in tuple so i can refactor in order to improve performance throughput,1
as a user id like to refer to hive sample so that i can use that as a reference to integrate hive to query and analyze,2
as a developer id like to deploy a stream in the same container so all modules are colocated within the container perhaps also consider building leader election within modules in order to automatically failover the application stream from one container to another,8
as a user id like to have guidance to create custom modules so that i can align the development practices with recommended approach 1120 update scope of this task is to create an example to demonstrate and document the capability,1
as a user id like to have the option to stop an existing sqoop job so that i can clean-up resources at the time of completion,8
as a s-c-d developer id like to enhance unit test coverage for yarn spi so i can continuously evaluate functionalities via ci pipeline,3
as a developer id like to upgrade to kafkas si ga release so that i can sync -up with the latest bits the scope is to backport kafka xd changes to si kafka and then upgrade to the ga release,5
as a spring xd developer id like to move twitterstream module from xd to s-c-s repo so i can use it as source modules to build streaming pipeline,2
as a developer id like to create ec2 ami with the necessary packages so that i can run the kafka perf tests,2
as a user id like to have the flexibility to configure db creds so that i can use a db of choice for batch job repository metadata persistence the scope of this task is to have the configuration specifics documented in the wiki,2
as a user id like to have the option to provide single-user security configurations so that i can override them as needed reference spring boot - securityhttpdocsspringiospring-bootdocs11x-snapshotreferencehtmlboot-features-securityhtml scope configurations can be provided through serversyml file,1
as a spring xd developer id like to move gpfdist module from xd to s-c-s repo so i can use it as sink to build streaming pipeline,2
as a user id like to have the configuration option to use an alternative dlq so i can publish the message this time with additional headers including one that contains the exception and stack trace,3
as a user id like to have the custom module built as uber-jar hosted in hdfs so that i can deploy the module to newly arriving containers,8
as a developer id like to update to si kafka extension 120 so i can leverage the latest performance improvements,1
as a user i would like to connect the sqoop batch job to teradata for import jobs i have tried the teradata jdbc driver directly using codejob create tdtest --definition sqoop --commandimport --args--table frequentflyers --connect jdbcteradatatdexpressdatabasetransportation --driver comteradatajdbcteradriver --username dbc --password dbc --target-dirxdteradata --num-mappers 1 code but that results in an npe the only way so far is to use the hortonworks connector for teradata - httppublic-repo-1hortonworkscomhdptools2242hdp-connector-for-teradata-1342242-2-distrotargz that one allows me to use the following codejob create tdtest --definition sqoop --commandimport --args--table frequentflyers --connect jdbcteradatatdexpressdatabasetransportation --connection-manager orgapachesqoopteradatateradataconnmanager --username dbc --password dbc --target-dirxdteradata --num-mappers 1 code,3
as a developer id like to add support to flush offsets intelligently so i can reliably process streams based on successful message acknowledgements from the module-producer,8
as a s-c-d developer id like to produce ref documentation for s-c-d architecture so i could define 1x and 2x deployment differences,8
as a follow up to xd-2877 experiment with the removal of the list of modules from basedefinition and reparse as needed branch is here httpsgithubcompperaltaspring-xdtreedeploy-refactor-2,8
as a user id like to refer to job orchestration documentation so i can use it as guideline for building batch workflows,3
as a qa id like to include acceptance test coverage for null sink module so that i can validate the functionality as part of every ci build,3
as a developer id like to revisit performance benchmarks with new improvements so i can verify the optimizations around jdbchdfs,1
as a user id like to have concurrency and compression support for kafka so that i can increase performance throughput andor increase responsiveness things to consider make global configuration options be defaults and allow per-deployment overrides add options for concurrency compression support,3
as a user id like to run the sqoop jobs against secured hdfs cluster so i can restrict access to only authorized users,3
as a xd developer id like to move header-enricher from modules repo to xd proper,1
as a user id like flo graphs as screenshots while referring to the batch dsl so it will be easy for me to relate to concepts,1
as a continuation we would like to further investigate spark develop poc and identify the best appropriate design and implementation for xd,8
as a developer id like to include the following improvements as part of the ec2 ci infrastructure so that we can reliably run the ci builds and also assert over feature functionalities scope enable distributed jvm test change from using artifactory gradle task to a command task that calls gradlew test w embedded hadoop off turn on maxparallelforks,5
as a spring xd user id like to make spi implementation profile aware so i can run java -jar admin or cf push admin or ltc create admin and the corresponding implementation gets wired-in automatically,3
as a users i would to be able to execute sql statementscript via a processor or job statement,3
as a user id like to use the java receptor client so i can interact with diego runtime using the java receptor rest apis,8
as a developer id like to build spark streaming as data processors in xd so that we can demonstrate some of the capabilities implement using java java lambdas scala,8
as a flo developer id like to have a new dsl parser so i can easily detect incorrect moduleoption values when supplied from the flo ui example mystream mail log tapstreammystreambar log if parsed separately which flo ui does the current parser endpoint will barf on the second stream because it doesnt know about the first stream mystream,8
as a s-c-d developer id like to create foundation to support processor as ootb modules so i can use the processor modules from s-c-s-m repo to build streaming pipeline,5
as a developer id like to add support for explicit partition count configuration so i can use this option to cleverly route the payload to the intended consumer module,5
as a developer id like to update to spring hadoop 220 ga release so i can leverage the latest improvements,1
as a s-c-d user id like to have runtime info as shell command so i can use this to list the details about the module such as host port and the like,5
as a user i want to have a documentation that shows how to configure multiple topics with kafka source module,1
