as a qa id like to include acceptance test coverage for aggregate-counter sink module so that i can validate the functionality as part of every ci build,3
as a s-c-d developer id like to support multiple app instances this is simply to make controlling app instances more clever potentially we could use deployment properties to define different yarn app instances like code cloud-datastream deploy --name ticktock --properties moduleyarnappnameapp cloud-datastream deploy --name ticktock --properties moduletimeyarnappnameapp code motivation to this is that different yarn apps can have different queues and priorities yarn administrator can define that some app queues have higher priority to reserve resources from using deployment properties like this allows to customize runtime parameters like how much we try to reserve memcpu for modules etc,2
as a user id like to use boot-based modulerunner for use in container-managed environments so i can run xd without xd-containers scope complete the remaining deployment properties work,8
as a spring xd developer id like to move hdfs-dataset module from xd to s-c-s repo so i can use it as sink to build streaming pipeline,5
as a user id like to have the option to change the default sqoop metastore so i can implement a db of my choice and not tied to default specifications refer to this threadhttpstackoverflowcomquestions24078668how-to-change-sqoop-metastore for more details,1
as a qa id like to include acceptance test coverage for spark-app batch job so that i can validate the functionality as part of every ci build,5
as a spring xd developer id like to move mongo module from xd to s-c-s repo so i can use it as sink to build streaming pipeline,2
as a user id like to have the option to delete the queuestopics so that we can include an optional attribute as part of the stream destroy command to also clean-up the associated queuestopics notes spring-amqp rabbitadmin now has a getqueueproperties method which returns the number of consumers so it may be possible to use it for this purpose consider the possibility of producers andor queues still containing data consider the scenario even after the topicsqueues are cleaned-up what to do with fanout exchange some further thoughts consider using the upcoming spring amqp rest api rabbitmanagementtemplate if the timing is not right we could temporarily invoke the rabbit rest api directly should be optional perhaps via stream destroy foo --clean should this be done by the admin or via a new plugin handling module undeployments - in the rabbit case undeploying a consumer would check for us being the last consumer and remove the queuebindingexchange since we undeploy left-right everything can be cleaned up on the consumer side third option would be new methods on the bus cleanconsumer etc invoked by the streamplugin down side of doing it on the admin is that he wouldnt necessarily know which rabbit cluster a stream was deployed to - so it probably has to happen on the container - even so wed need the admin urls for the cluster,5
as a developer id like to complete the remaining work with debs challenge so i can submit by the deadline,2
as a developer id like to rebalance partitions as we scale the containers so i dont have to bring down the running streamjob to reestablish dynamic partitions,8
as a field engineer id like to have reference architectures built on spring xd so that i can use that as reference building pocs the scope is to get the raw domain specific ideas captured as first step,8
as a build manager id like to have spring xd rpms published in springio repository so that users can directly download the bits without having to go through appsuite repo or the eula location for 110 release httprepospringiolibs-release-localorgspringframeworkxdspring-xd110release,2
as a pm id like to have a static ghpages to organize the collateral such as samples tutorials links perf benchmarks and ref architectures so that its easy for anyone to quickly get up and running on xd,8
as a user id like to have the option to use the sftp source module so that i can access transfer and mange files over any reliable data streams reference spring integration sftp adapterhttpdocsspringiospring-integrationreferencehtmlsftphtml need to consider the infrastructure for testing,2
as a s-c-s user id like to investigate the possibility of s-c-s modules self-registering themselves to service discovery so i could use spring xd runtime running on cf to discover and orchestrate such modules through streams,8
as a developer id like to complete the remaining kryo optimization changes so i can polish and get the guidelines documented appropriately,1
as a s-c-s developer id like to setup ci infrastructure for spring-cloud-stream-modules s-c-s-m repo so i can build the project continuously on every commits,3
as a user id like to leverage propertieis-location parameter while using filter or transform modules so that i can load the user-defined properties included in the external properties file attempting to include the propertieis-location attribute errors out - refer to the attachment it could also be beneficial to load user-defined properties through stream definition similar to deployment properties example --scriptmyscriptgroovy --variablesfoobargoogaz,5
as a s-c-d developer id like to move kafka module from xd to s-c-s repo so i can use it as source to build streaming pipeline,2
as a developer id like to have a maintenance branch so that i can commit minor release ex 102 code changes instead of committing to master,5
as a flo user id like to have timeout and pollinterval as global options at the dsl level so i can override the defaults at will,1
as a s-c-d developer id like to add support for having different binder types for modules channels so i can plug rabbit redis or kafka as the source or sink to read and write respectively,8
as a developer id like to publish performance benchmarks along with the infrastructure specifics so the users can use it as a reference while setting up spring xd cluster,8
as a spring xd developer id like to port ftpsftp module from xd to s-c-s repo so i can use it as sink modules to build streaming pipeline,2
as a spring xd developer id like to port ftpsftp modules from xd to s-c-s repo so i can use them as source modules to build streaming pipeline,2
as a user id like to also have the capability to upload the custom module through mavengradle targets so i can automate the installation of custom module fragments,2
as a s-c-d developer id like to add support to expose counter metrics endpoints so i can consume to feed the dashboards to demonstrate firehose counter pipe,3
as a user id like to have the option to write into file roll sink so that i can store events on the local file system,8
as a user id like to have the option to setup batching so that i can ingest data in batches as opposed to payload-at-a-time,8
as a developer id like to upgrade to reactor 204 release so i could leverage the latest improvements and bug-fixes,1
as a module author i want to be able to test my code in next to real world conditions ie integration testing but not really - i want all my module wiring to be testable - i want all my module configuration configurationproperties to be in effect and i want to be able to test various combination of props - i want to be able to send data to my module and assert what is coming at the other end - i want an idiomatic way of asserting the above eg integration with hamcrest etc - i dont want to have to send data to an actual bus redis rabbit etc,5
as a developer id like to build isolated boot-based modulerunner for use in container-managed environments so i can run xd without the hard requirement for running xd-containers,8
as a user id like to use partitionresultstimeout attribute for jobs that inherit singlestep-partitioning strategy but it is not exposed as a metadata attribute in the wiki note the property should be available for all the jobs that import 3 ootb jobs have it imported ref attachment,1
as a user id like to have a gradle build option so that i can support module projects that will declare the spring xd dependencies as provided configure the boot plugin for module layout and other boilerplate build configuration this is dependent on boots module layout scoping issue httpsgithubcomspring-projectsspring-bootissues2187,3
as a developer id like to revisit the existing design and identify known limitations andor the gaps,5
as a qa id like to include acceptance test coverage for aggregator processor module so that i can validate the functionality as part of every ci build,3
as a developer id like to move the project reactor based data processor modulehttpsgithubcomspring-projectsspring-xd-modulestreemasterspring-xd-reactor from spring-xd-module repo to the core so i can natively use reactors stream api to build processor modules,3
as a user id like to have spring core upgraded to 411 milestone so that i can benefit from performance improvements associated with compiled spel and other enhancements,3
as a user id like to have the option of aws sink so that i can write data into s3 directly reference spring integration aws extensionhttpsgithubcomspring-projectsspring-integration-extensionstreemasterspring-integration-aws,5
as a user id like to have the option to gracefully shutdown the stream so when it is undeployed while in the middle of its operation we would want to complete its journey to the sink before xd stops the stream use case one of the streams has a custom module that performs archive extraction when this stream is undeployed while in the middle of extraction it looks like the message goes to the dlq however we would like the message to complete its journey to the sink of the queue before xd stops the stream is this possible,8
as a developer id like to create separate repo for yarn spi so i dont have to bundle all spi variants under one admin project,5
as a developer id like to troubleshoot the performance issues with rabbit as message bus implementation so i can isolate the bottleneck and fix as appropriate,8
as a user id like to add the hadoop namenode specifics in a config file so that i dont have to incur the hassle of pointing to the namenode location every time i open a new dsl session but it is automatically configured,3
as a scala developer someone could easily deploy the spark streaming module developed using scala,8
as a developer i would like to connect to the broker that hosts the rabbit queue so i can connect to a rabbit cluster thats setup for haft perhaps consider having this feature natively supported in spring amqp itself,3
as a user id like to refer to documentation so that i can build the custom module based on recommended standards and patterns,3
as a developer id like to upgrade to kafka 082 so i can leverage the latest features in order to test the performance characteristics,8
as a module author i would like to apply rxjava processor module with spring cloud stream,3
as a user i would like to use fsuri file to use hadoop localfilesystem instead of a running cluster in my use case my data scientist team requested to provide me a local csv of data that is being loaded using jdbchdfs job the quickest way to solve this was to change the fsuri to file and it should have just worked this will work alright for singlenode setups for multiple containers hosted on multiple machines will split the file across different machines - but then i believe it is fair to assume that the developer must know what he is doing,1
as a developer id like to create a tuple load-generator so i can use it to measure tuple based payload performance,3
as a user i would like to be able to configure the logging directory to be outside of what is defined as xdhome the logging directory is currently hard coded as codexdhomelogscode this would be useful for rpm installations where the logs really should be going to varlogsspring-xd instead of the current optpivotalspring-xdxdlogs location,3
as a s-c-d developer id like to complete documentation and test-cases on resolving and adding jars to boot loader so we could use this as a reference while porting modules with external dependencies,3
as a user im trying to setup ha cluster using ambari installed spring xd however im running into issues with the overrides more details herehttpsgithubcomspring-projectsspring-xd-ambariissues6,5
as a developer id like to document how to nest batch jobs and workflows in xd so it will be easy for end-users to use it as reference,1
as a user id like to have the option to supply data partitioning strategy so that i can parallelize ingest of data from rdbms to hdfs,8
as a data scientist id like to have the option to process data using flink processor so i can take advantage of the streaming machine learning abstractions implemented on top of flink,5
as a spring xd developer id like to move mail module from xd to s-c-s repo so i can use it as sink to build streaming pipeline,2
as a s-c-d developer id like to break the build lifecycle to bundle spi deployers individually so i dont have to build admin with all the deployer variations as one whole thing,8
as a spring xd developer id like to create initial version of the new module registry abstraction so we could leverage the foundation to make progress and test the respective spi receptor or cloudcontroller implementations,5
as a developer id like to define pluggable runtime spi so i have the option to choose the implementation based on deployment targets such as cf on-prem mesos etc,5
as a user id like to include the deployment manifest from the file so that i dont have spend time typing as inline properties,3
as a qa id like to include acceptance test coverage for hdfs-dataset module so that i can validate the functionality as part of every ci build,3
as a developer i want to have a binderfactory abstraction so that i can support multiple binder types in the future,5
as a s-c-d developer id like to experiment how do we resolve and then add module dependent jars to boot loader so i have an approach to handle external libraries required by ootb modules,5
as a user id like to have the option to version the custom modules so i can evolve the custom module fragments in increments and be able to roll-out upgrades seamlessly,5
as a s-c-d developer id like to move the external library to its own project so we have a clear separation of functionalities in s-c-d repo,3
as a developer id like to have acceptance test coverage for xd yarn on ec2 so that i can verify simple xd features running on yarn on every build cycle,8
as a s-c-s user id like to have the option to direct bind modules so i dont have to use messaging middleware and i can eliminate latency between them this is important for high throughput and low latency use cases,8
as a s-c-d developer id like to enhance integration test coverage for cc spi so i can continuously evaluate functionalities via ci pipeline,3
as a user id like to have an optional arbitrary side channels created so that when creating a module channels other than the primary stream channels input output could be added to the bus ie creating a tap channel within a flow the optional side channels can be used to tracetrack module progress,8
as a user id like to stream ingest audio and video data so that i can apply predictive analytics algorithms for facial detection spike scope research the feasibility of implementing motion-jpeghttpenwikipediaorgwikimotionjpeg design specs on motion-jpeg format note opencvhttpdocsopencvorgtrunkdocpytutorialspyobjdetectpyfacedetectionpyfacedetectionhtml although having ootb support it is not platform compatible,8
as a s-c-d developer id like to create a new project to contain all the rules associated redisrule contract so it is isolated from core functionalities and reusable by test coverage as needed consider moving this coverage to si commons or equivalent,5
as a s-c-s user id like to search the modules by its name aside from the default springapplicationname offered by boot so i can also fetch modules by its name,2
as a user id like to have the option to extend compression support so that i can override the defaults and customize as needed follow-up from this pr httpsgithubcomspring-projectsspring-xdpull1346,3
as a user id like to have a perf-meter sink that will collect and push metrics to the standard container log file example perf-meter --nummsgs 1000 will write to the container log a timestamp message count and message rate every 1000 messages the message rate is the value since the last log event default values are those specified above,8
as a performance tester id like to investigate why theres high cpu startup time for both admin and container servers perhaps profiling would assist isolating the bottlenecks scope identify the bottlenecks document reasons list proscons,8
as a s-c-d developer id like to create moduleregistry stubs so i can create mock streams by interacting with the registry apis,3
as a s-c-d developer id like to establish the foundation to expose rest-apis to interact with the xd-admin and likewise perform crud operations to maneuver streaming and batch pipelines,5
as a spring xd developer id like to port filter module from xd to s-c-s repo so i can use it as processor module to build streaming pipeline,2
as a spring xd developer id like to port file module from xd to s-c-s repo so i can use it as sink module to build streaming pipeline,2
as a developer id like to add undeployed status for cf spi so i can represent the correct status instead of the current unknown state,3
as a user i need to use xd sqoop module to support the merge command currently the sqooprunner createfinalarguments method forces the requirement for connect username and password options which are not valid for the merge option a check of the module type to not force these options being assigned to sqoop arg list would be preferred,5
as a user im trying to load task task deployment and task executions page but im seeing an error error fetching data is the xd server running instead,1
as a s-c-d user id like to have the option of gemfire spi so i can use gemfire and the infrastructure to orchestrate s-c-d data microservices,8
as a user im trying to create a composed job with 20 stepstransitions using rabbit as the message bus and it doesnt complete successfully,3
as a user id like to see the version and spi type in the about section so i can confirm which build of admin-ui im currently using,1
as a spring xd developer id like to move cassandra module from xd to s-c-s repo so i can use it as sink to build streaming pipeline,5
as a user id like to clean up message bus resources associated with the stream so that when the stream is destroyed so does the coupled queuestopics,3
as a developer id like to create a new load-generator so i can use it to measure highly optimized kryo serialized payload to measure the performance differences,3
as a s-c-d developer id like to invoke rest apis via shell so i can validate streamcontroller operations,8
as a developer id like to move inputoutput type conversion from spring xd repo into spring-bus so i can update spring xd to inherit the featuresfunctionalities via maven dependency,8
as a user id like to have the option to configure default access control for endpoints so that i can grant access by admin or viewer roles,8
as a developer id like to port log module from xd to s-c-s repo so i can use it as sink modules to build streaming pipeline,2
as a user id like to create a stream such as generator perf-meter so that i can ingest 1m messages of 1000 bytes and one thread using xds singlenode container and measure performance characteristics,8
as a user id like to use boot-based modulerunner for use in container-managed environments so i can run xd without xd-containers scope,5
as a developer id like to use an efficient approach to read files so i dont have to read line-by-line and keep it in-memory in order to consumewrite the file content would the tasklet approach be better as opposed to transmitting data via message bus as streams,5
as a developer id like to use spring-cloud-config server for spring-bus modules so i can centrally manage external properties,8
as a developer i need to investigate the differences in dependency versions so when i createdeploy custom modules in xd i dont run into cpcl issues,1
as a developer id like to build data pipeline using kafka as as message bus in xd so that we can demonstrate some of the capabilities use case to consider log aggregation and analysis lambda architecture how to avoid code duplication how to eliminate tight coupling of business logic how kafka can be used for reliable reprocessing,8
as a s-c-d user id like to add rest support for stream commands so i can maneuver streaming pipeline backed by streamcontroller,5
as a spring xd developer id like to move reactor-ip module from xd to s-c-s repo so i can use it as source to build streaming pipeline,2
as a s-c-s user id like to have my modules addupdate its current state to eureka so i can use the repository to discover the current sate of the module as needed,2
as a s-c-d developer id like to add as many jars via a bom eg hadoop distro deps so i dont have to explicitly worry about individual but related libraries,2
as a developer id like to create separate repo for mesos spi so i dont have to bundle all spi variants under one admin project,3
as a user id like to refer to the documentation so that i can connect to sqoop as recommended and create job definition based on the exposed metadata options,1
as a qa id like to include acceptance test coverage for richgauge sink module so that i can validate the functionality as part of every ci build,3
as a developer id like to move serialization codec from spring xd repo into spring-bus so i can update spring xd to inherit the featuresfunctionalities via maven dependency,8
as a s-c-s-m developer id like to move jdbc module from xd to s-c-s repo so i can use it as sink to build streaming pipeline see also xd-2250,5
as a spring xd developer id like to move null module from xd to s-c-s repo so i can use it as sink to build streaming pipeline,2
as a user id like to have the option to enable https so that i can access xds admin server endpointshttpsgithubcomspring-projectsspring-xdwikirest-apixd-resources over secured communication technical implementation this functionality is available in spring boot 120 m1 and has been backported into the 11x branch to be released under spring 117 we can test against 117 snapshot working through the way to update the build file to pick up a new version of boot is a bit tricky,1
as a developer id like to measure the baseline serialization characteristics in xd so i can determine the areas of performance improvements,5
as a spring-cloud-stream user id like to build stream definitions using dot-delimited syntax for resolving properties for tuple and json,3
as a user im trying to get all job definitions but the first 20 alone are returned job samples code job create aaa --definition hello --deploy job create bbb --definition hello --deploy job create ccc --definition hello --deploy job create ddd --definition hello --deploy job create eee --definition hello --deploy job create fff --definition hello --deploy job create ggg --definition hello --deploy job create hhh --definition hello --deploy job create iii --definition hello --deploy job create jjj --definition hello --deploy job create kkk --definition hello --deploy job create lll --definition hello --deploy job create mmm --definition hello --deploy job create nnn --definition hello --deploy job create ooo --definition hello --deploy job create ppp --definition hello --deploy job create qqq --definition hello --deploy job create rrr --definition hello --deploy job create sss --definition hello --deploy job create ttt --definition hello --deploy job create uuu --definition hello --deploy job create vvv --definition hello --deploy job create www --definition hello --deploy job create xxx --definition hello --deploy job create yyy --definition hello --deploy job create zzz --definition hello --deploy job create aaa1 --definition hello --deploy job create bbb1 --definition hello --deploy job create ccc1 --definition hello --deploy job create ddd1 --definition hello --deploy job create eee1 --definition hello --deploy code request httplocalhost9393jobsdefinitionsjson - returns top 20 the other experiments with page size of either 0 or -1 still brings the top 20,1
as a user id like to have the option to stop an existing spark job so that i can clean-up resources at the time of completion,3
as a user id like to retain the data partitioning state so that when i restart the containers i continue to write based on the original partitioning strategy currently the state is not preserved hence on restarts the definition of partitioning strategy is lost due to different hashcode design consideration mine through the container info to derive the partition index instead of relying on hashcode,5
as a spring xd developer id like to port http module from xd to s-c-s repo so i can use it as source module in streaming pipeline,2
as a s-c-d developer id like to enhance unit test coverage for lattice spi so i can continuously evaluate functionalities via ci pipeline,3
as a developer id like to research and identify the ec2 infrastructure required so that i can run performance tests on kafka,3
as a s-c-d developer id like to move kafka module from xd to s-c-s repo so i can use it as sink to build streaming pipeline,2
as a user i want to be able to provide the partitioning logic for a named destination so that i can control the ordering of outbound messages,1
as a spring xd developer id like to port analytic-pmml module from xd to s-c-s repo so i can use it as processor module to build streaming pipeline,5
